{
  "$schema": "http://json-schema.org/draft-07/schema#",
  "definitions": {
    "Identifier": {
      "type": "string",
      "pattern": "^[a-z0-9_.-]+:[a-z0-9/._-]+$"
    },
    "Tag": {
      "type": "string",
      "pattern": "^#[a-z0-9_.-]+:[a-z0-9/._-]+$"
    },
    "RegistryEntryList": {
      "type": "array",
      "items": {
        "anyOf": [
          {
            "$ref": "#/definitions/Identifier"
          },
          {
            "$ref": "#/definitions/Tag"
          }
        ]
      }
    },
    "LockList": {
      "anyOf": [
        {
          "type": "object",
          "additionalProperties": false,
          "properties": {
            "message": {
              "type": "string"
            },
            "entries": {
              "$ref": "#/definitions/RegistryEntryList"
            }
          },
          "required": [
            "entries"
          ]
        },
        {
          "$ref": "#/definitions/RegistryEntryList"
        }
      ]
    }
  },
  "type": "object",
  "additionalProperties": false,
  "properties": {
    "blocks": {
      "$ref": "#/definitions/LockList"
    },
    "entities": {
      "$ref": "#/definitions/LockList"
    },
    "items": {
      "$ref": "#/definitions/LockList"
    },
    "enchantments": {
      "$ref": "#/definitions/LockList"
    },
    "recipes": {
      "$ref": "#/definitions/LockList"
    },
    "item_components": {
      "type": "object",
      "additionalProperties": false,
      "patternProperties": {
        "^[a-z0-9_.-]+:[a-z0-9/._-]+$": {
          "type": "object",
          "additionalProperties": false,
          "properties": {
            "type": {
              "$ref": "#/definitions/Identifier"
            },
            "values": {
              "type": "array",
              "minItems": 1
            }
          },
          "required": [
            "type",
            "values"
          ]
        }
      }
    },
    "requirements": {
      "type": "array",
      "items": {
        "type": "object",
        "additionalProperties": false,
        "patternProperties": {
          "^[a-z0-9_.-]+:[a-z0-9/._-]+$": {
            "type": "integer"
          }
        }
      }
    }
  },
  "required": [
    "requirements"
  ]
}

