{
  "blocks": [
    "minecraft:crafting_table",
    "minecraft:end_gateway"
  ],
  "items": {
    "entries": [
      "minecraft:potato",
      "minecraft:poisonous_potato",
      "minecraft:ender_eye"
    ],
    "message": "You don't know if this potato is safe to eat"
  },
  "recipes": {
    "entries": [
      "minecraft:baked_potato"
    ],
    "message": "You don't know how to cook this potato"
  },
  "requirements": [
    {
      "rpg_test:potato": 1
    }
  ]
}