{
  "blocks": {
    "entries": [
      "#minecraft:buttons"
    ],
    "message": "How to press?"
  },
  "item_components": {
    "minecraft:goat_horn": {
      "type": "minecraft:instrument",
      "values": [
        "minecraft:admire_goat_horn"
      ]
    },
    "minecraft:potion": {
      "type": "minecraft:potion_contents",
      "tooltip_index": 1,
      "values": [
        {
          "potion": "minecraft:turtle_master"
        }
      ]
    }
  },
  "items": {
    "entries": [
      "minecraft:red_concrete",
      "minecraft:blue_concrete",
      "#minecraft:buttons"
    ],
    "message": "You don't know what kind of button this is"
  },
  "recipes": {
    "entries": [
      "#minecraft:buttons"
    ],
    "message": "You don't know how to assemble this button"
  },
  "requirements": [
    {
      "rpg_test:cow": 1,
      "rpg_test:potato": 3
    },
    {
      "rpg_test:cow": 1,
      "rpg_test:grass": 2
    }
  ]
}