{
  "enchantments": [
    "minecraft:aqua_affinity"
  ],
  "entities": {
    "entries": [
      "minecraft:villager",
      "minecraft:chicken",
      "minecraft:armor_stand",
      "minecraft:tnt_minecart",
      "minecraft:boat"
    ],
    "message": "AAA"
  },
  "items": {
    "entries": [
      "minecraft:trident",
      "minecraft:diamond_helmet",
      "minecraft:cod",
      "minecraft:chest_minecart",
      "minecraft:armor_stand",
      "minecraft:arrow",
      "#minecraft:boats"
    ],
    "message": "You don't know how to eat with this fork"
  },
  "recipes": {
    "entries": [
      "minecraft:prismarine_bricks",
      "minecraft:netherite_helmet"
    ],
    "message": "You don't know how to assemble this prismarine"
  },
  "requirements": [
    {
      "rpg_test:potato": 2
    },
    {
      "rpg_test:cow": 2
    },
    {
      "rpg_test:grass": 2
    }
  ]
}